# UPDATE / DELETE ... LIMIT conformance.
#
# MySQL allows a row-count LIMIT on UPDATE and DELETE: it caps the number of
# affected rows. Without an ORDER BY the affected rows are unspecified on both
# MySQL and the engine, so those tests assert only counts -- never which
# specific rows. With an ORDER BY ... LIMIT the affected rows are determined by
# sort order (see dml_order_by_limit.test for that rewrite). The count-only
# LIMIT form is required (no OFFSET).
#
# Expected to pass against both turso-mysql-server and a real mysqld. Uses its
# own table names.

# UPDATE ... LIMIT n affects exactly n rows when at least n match.
statement ok
CREATE TABLE IF NOT EXISTS udl_u (id INT PRIMARY KEY, flag INT DEFAULT 0)

statement ok
INSERT INTO udl_u (id) VALUES (1), (2), (3), (4), (5)

statement ok
UPDATE udl_u SET flag = 1 LIMIT 2

# Exactly two rows were flagged, three left untouched (which two is unspecified).
query
SELECT COUNT(*) FROM udl_u WHERE flag = 1
----
2

query
SELECT COUNT(*) FROM udl_u WHERE flag = 0
----
3

# A LIMIT larger than the number of matching rows updates them all.
statement ok
UPDATE udl_u SET flag = 1 LIMIT 100

query
SELECT COUNT(*) FROM udl_u WHERE flag = 1
----
5

# DELETE ... LIMIT n removes exactly n rows when at least n match.
statement ok
CREATE TABLE IF NOT EXISTS udl_d (id INT PRIMARY KEY, n INT)

statement ok
INSERT INTO udl_d (id, n) VALUES (1, 10), (2, 20), (3, 30), (4, 40), (5, 50)

statement ok
DELETE FROM udl_d LIMIT 2

query
SELECT COUNT(*) FROM udl_d
----
3

# A WHERE narrows the candidates; a LIMIT exceeding them deletes them all.
statement ok
DELETE FROM udl_d WHERE id <= 5 LIMIT 100

query
SELECT COUNT(*) FROM udl_d
----
0

# ORDER BY ... LIMIT on UPDATE/DELETE is rewritten through a rowid subquery, so
# it picks specific rows by sort order (deterministic). udl_u holds ids 1-5, all
# flag = 1.
statement ok
DELETE FROM udl_u ORDER BY id ASC LIMIT 1

# The smallest id (1) was deleted.
query
SELECT id FROM udl_u ORDER BY id
----
2
3
4
5

statement ok
UPDATE udl_u SET flag = 0 ORDER BY id DESC LIMIT 1

# The largest id (5) was flipped to 0.
query
SELECT id, flag FROM udl_u ORDER BY id
----
2	1
3	1
4	1
5	0

# An OFFSET on the row-count LIMIT is rejected (MySQL does not allow it here).
statement error
DELETE FROM udl_u LIMIT 1, 2
